{
  "identity": { "id": "NPC_RANHONGLIAN", "name": "乱红莲" },
  "period": "original_campaign/P1#1068/狮子王解封后",
  "narrativeRole": "狮子王召唤的灵兽",
  "combatProfile": { "style": "爪牙近战", "strengths": [], "weaknesses": [] },
  "abilityConcepts": [],
  "narrativeSources": {
    "narrativeRole": "extracted-first/22/posts.md#1068:201-203",
    "combatProfile": "extracted-first/22/posts.md#1068:206-210"
  },
  "sourceStatus": "EXISTING_SOURCE"
}
